{"_meta": {"api_version": "1", "contract_version": "1.19", "generated_at": "2026-07-27T18:07:34+00:00", "provenance": "socrata", "data_tier": "mixed", "tier_note": "trend is real; findings each carry their own data_tier; bikeway_mileage and protected_share are derived.", "caveats": [{"code": "not_normalized_by_ridership", "text": "Crash counts are raw, not normalized by ridership (no public cyclist-volume data is joined yet), so busy corridors look worse than dangerous quiet ones."}, {"code": "recent_months_provisional", "text": "Recent months are provisional \u2014 crash records get amended upstream, so the most recent 1-2 months of any trend may still move."}, {"code": "dooring_undercounted", "text": "Dooring crashes are structurally undercounted in police crash reports (see the dooring-undercount finding)."}], "license": "City of Chicago Data Portal Terms of Use (data.cityofchicago.org); derived analyses by On Your Left!", "attribution": "On Your Left! \u2014 Chicago bike safety, on the record (https://github.com/jartinator/chicago-safe-streets-data)", "human_page": "https://jartinator.github.io/chicago-safe-streets-data/findings.html", "methodology": "https://jartinator.github.io/chicago-safe-streets-data/methodology.html", "schema": "https://jartinator.github.io/chicago-safe-streets-data/api/v1/schemas/citywide.schema.json", "caveat_contract": "v1", "agent_instruction": "Always name the caveat next to any number you take from this file. Every object holding a number carries either a `caveat` field or a `<field>_caveat` sibling named for the number. Never state a number from this file without its caveat. Never present mock-tier data as real."}, "trend": {"data_tier": "real", "window_end": "2026-07-26", "note": "Monthly counts of police-reported cyclist crashes citywide since Sept 2017; ksi = crashes whose worst injury was fatal or incapacitating (\"killed or seriously injured\"). Recent months are provisional \u2014 records get amended.", "months": [{"month": "2017-09", "crashes": 296, "injury_crashes": 171, "ksi": 33, "fatal": 0}, {"month": "2017-10", "crashes": 232, "injury_crashes": 131, "ksi": 30, "fatal": 0}, {"month": "2017-11", "crashes": 124, "injury_crashes": 71, "ksi": 17, "fatal": 1}, {"month": "2017-12", "crashes": 65, "injury_crashes": 30, "ksi": 8, "fatal": 2}, {"month": "2018-01", "crashes": 56, "injury_crashes": 23, "ksi": 2, "fatal": 0}, {"month": "2018-02", "crashes": 46, "injury_crashes": 25, "ksi": 10, "fatal": 0}, {"month": "2018-03", "crashes": 78, "injury_crashes": 40, "ksi": 7, "fatal": 0}, {"month": "2018-04", "crashes": 106, "injury_crashes": 63, "ksi": 14, "fatal": 0}, {"month": "2018-05", "crashes": 219, "injury_crashes": 137, "ksi": 26, "fatal": 0}, {"month": "2018-06", "crashes": 237, "injury_crashes": 147, "ksi": 25, "fatal": 1}, {"month": "2018-07", "crashes": 292, "injury_crashes": 176, "ksi": 31, "fatal": 1}, {"month": "2018-08", "crashes": 312, "injury_crashes": 193, "ksi": 31, "fatal": 2}, {"month": "2018-09", "crashes": 255, "injury_crashes": 149, "ksi": 17, "fatal": 1}, {"month": "2018-10", "crashes": 175, "injury_crashes": 97, "ksi": 13, "fatal": 0}, {"month": "2018-11", "crashes": 98, "injury_crashes": 35, "ksi": 2, "fatal": 0}, {"month": "2018-12", "crashes": 70, "injury_crashes": 31, "ksi": 4, "fatal": 0}, {"month": "2019-01", "crashes": 45, "injury_crashes": 22, "ksi": 2, "fatal": 0}, {"month": "2019-02", "crashes": 45, "injury_crashes": 26, "ksi": 1, "fatal": 0}, {"month": "2019-03", "crashes": 77, "injury_crashes": 36, "ksi": 8, "fatal": 1}, {"month": "2019-04", "crashes": 126, "injury_crashes": 65, "ksi": 12, "fatal": 0}, {"month": "2019-05", "crashes": 166, "injury_crashes": 101, "ksi": 19, "fatal": 0}, {"month": "2019-06", "crashes": 223, "injury_crashes": 135, "ksi": 18, "fatal": 0}, {"month": "2019-07", "crashes": 297, "injury_crashes": 196, "ksi": 37, "fatal": 0}, {"month": "2019-08", "crashes": 295, "injury_crashes": 176, "ksi": 28, "fatal": 0}, {"month": "2019-09", "crashes": 259, "injury_crashes": 167, "ksi": 29, "fatal": 1}, {"month": "2019-10", "crashes": 196, "injury_crashes": 111, "ksi": 16, "fatal": 0}, {"month": "2019-11", "crashes": 109, "injury_crashes": 53, "ksi": 9, "fatal": 2}, {"month": "2019-12", "crashes": 72, "injury_crashes": 38, "ksi": 4, "fatal": 0}, {"month": "2020-01", "crashes": 48, "injury_crashes": 28, "ksi": 7, "fatal": 0}, {"month": "2020-02", "crashes": 52, "injury_crashes": 28, "ksi": 2, "fatal": 1}, {"month": "2020-03", "crashes": 56, "injury_crashes": 27, "ksi": 7, "fatal": 0}, {"month": "2020-04", "crashes": 36, "injury_crashes": 22, "ksi": 4, "fatal": 0}, {"month": "2020-05", "crashes": 91, "injury_crashes": 49, "ksi": 11, "fatal": 0}, {"month": "2020-06", "crashes": 164, "injury_crashes": 102, "ksi": 16, "fatal": 1}, {"month": "2020-07", "crashes": 228, "injury_crashes": 144, "ksi": 29, "fatal": 1}, {"month": "2020-08", "crashes": 248, "injury_crashes": 158, "ksi": 31, "fatal": 1}, {"month": "2020-09", "crashes": 192, "injury_crashes": 129, "ksi": 14, "fatal": 1}, {"month": "2020-10", "crashes": 134, "injury_crashes": 86, "ksi": 15, "fatal": 1}, {"month": "2020-11", "crashes": 88, "injury_crashes": 42, "ksi": 9, "fatal": 0}, {"month": "2020-12", "crashes": 50, "injury_crashes": 27, "ksi": 5, "fatal": 0}, {"month": "2021-01", "crashes": 40, "injury_crashes": 26, "ksi": 4, "fatal": 0}, {"month": "2021-02", "crashes": 14, "injury_crashes": 9, "ksi": 2, "fatal": 0}, {"month": "2021-03", "crashes": 70, "injury_crashes": 42, "ksi": 7, "fatal": 0}, {"month": "2021-04", "crashes": 106, "injury_crashes": 68, "ksi": 11, "fatal": 0}, {"month": "2021-05", "crashes": 147, "injury_crashes": 88, "ksi": 12, "fatal": 1}, {"month": "2021-06", "crashes": 200, "injury_crashes": 130, "ksi": 20, "fatal": 0}, {"month": "2021-07", "crashes": 230, "injury_crashes": 149, "ksi": 30, "fatal": 2}, {"month": "2021-08", "crashes": 215, "injury_crashes": 143, "ksi": 20, "fatal": 1}, {"month": "2021-09", "crashes": 206, "injury_crashes": 126, "ksi": 14, "fatal": 1}, {"month": "2021-10", "crashes": 171, "injury_crashes": 106, "ksi": 17, "fatal": 0}, {"month": "2021-11", "crashes": 87, "injury_crashes": 48, "ksi": 6, "fatal": 1}, {"month": "2021-12", "crashes": 68, "injury_crashes": 38, "ksi": 9, "fatal": 1}, {"month": "2022-01", "crashes": 29, "injury_crashes": 20, "ksi": 5, "fatal": 0}, {"month": "2022-02", "crashes": 32, "injury_crashes": 21, "ksi": 2, "fatal": 0}, {"month": "2022-03", "crashes": 77, "injury_crashes": 44, "ksi": 5, "fatal": 0}, {"month": "2022-04", "crashes": 102, "injury_crashes": 71, "ksi": 16, "fatal": 0}, {"month": "2022-05", "crashes": 184, "injury_crashes": 131, "ksi": 25, "fatal": 1}, {"month": "2022-06", "crashes": 238, "injury_crashes": 147, "ksi": 26, "fatal": 1}, {"month": "2022-07", "crashes": 238, "injury_crashes": 151, "ksi": 20, "fatal": 0}, {"month": "2022-08", "crashes": 233, "injury_crashes": 142, "ksi": 24, "fatal": 2}, {"month": "2022-09", "crashes": 236, "injury_crashes": 149, "ksi": 26, "fatal": 0}, {"month": "2022-10", "crashes": 164, "injury_crashes": 95, "ksi": 18, "fatal": 0}, {"month": "2022-11", "crashes": 121, "injury_crashes": 65, "ksi": 11, "fatal": 0}, {"month": "2022-12", "crashes": 62, "injury_crashes": 33, "ksi": 9, "fatal": 1}, {"month": "2023-01", "crashes": 37, "injury_crashes": 20, "ksi": 3, "fatal": 0}, {"month": "2023-02", "crashes": 50, "injury_crashes": 26, "ksi": 6, "fatal": 0}, {"month": "2023-03", "crashes": 68, "injury_crashes": 37, "ksi": 7, "fatal": 0}, {"month": "2023-04", "crashes": 110, "injury_crashes": 64, "ksi": 8, "fatal": 0}, {"month": "2023-05", "crashes": 179, "injury_crashes": 108, "ksi": 17, "fatal": 0}, {"month": "2023-06", "crashes": 250, "injury_crashes": 159, "ksi": 26, "fatal": 1}, {"month": "2023-07", "crashes": 255, "injury_crashes": 150, "ksi": 22, "fatal": 0}, {"month": "2023-08", "crashes": 287, "injury_crashes": 173, "ksi": 25, "fatal": 0}, {"month": "2023-09", "crashes": 256, "injury_crashes": 162, "ksi": 22, "fatal": 0}, {"month": "2023-10", "crashes": 231, "injury_crashes": 130, "ksi": 23, "fatal": 1}, {"month": "2023-11", "crashes": 141, "injury_crashes": 75, "ksi": 8, "fatal": 0}, {"month": "2023-12", "crashes": 105, "injury_crashes": 49, "ksi": 6, "fatal": 0}, {"month": "2024-01", "crashes": 49, "injury_crashes": 19, "ksi": 5, "fatal": 0}, {"month": "2024-02", "crashes": 87, "injury_crashes": 41, "ksi": 7, "fatal": 0}, {"month": "2024-03", "crashes": 112, "injury_crashes": 56, "ksi": 9, "fatal": 0}, {"month": "2024-04", "crashes": 128, "injury_crashes": 76, "ksi": 7, "fatal": 0}, {"month": "2024-05", "crashes": 247, "injury_crashes": 149, "ksi": 22, "fatal": 0}, {"month": "2024-06", "crashes": 286, "injury_crashes": 174, "ksi": 29, "fatal": 0}, {"month": "2024-07", "crashes": 295, "injury_crashes": 178, "ksi": 19, "fatal": 0}, {"month": "2024-08", "crashes": 307, "injury_crashes": 175, "ksi": 26, "fatal": 0}, {"month": "2024-09", "crashes": 303, "injury_crashes": 175, "ksi": 24, "fatal": 1}, {"month": "2024-10", "crashes": 291, "injury_crashes": 167, "ksi": 15, "fatal": 1}, {"month": "2024-11", "crashes": 129, "injury_crashes": 68, "ksi": 13, "fatal": 1}, {"month": "2024-12", "crashes": 102, "injury_crashes": 54, "ksi": 4, "fatal": 0}, {"month": "2025-01", "crashes": 67, "injury_crashes": 36, "ksi": 5, "fatal": 0}, {"month": "2025-02", "crashes": 54, "injury_crashes": 19, "ksi": 1, "fatal": 0}, {"month": "2025-03", "crashes": 125, "injury_crashes": 65, "ksi": 9, "fatal": 0}, {"month": "2025-04", "crashes": 157, "injury_crashes": 94, "ksi": 10, "fatal": 0}, {"month": "2025-05", "crashes": 222, "injury_crashes": 118, "ksi": 19, "fatal": 0}, {"month": "2025-06", "crashes": 322, "injury_crashes": 192, "ksi": 21, "fatal": 0}, {"month": "2025-07", "crashes": 331, "injury_crashes": 190, "ksi": 22, "fatal": 1}, {"month": "2025-08", "crashes": 390, "injury_crashes": 241, "ksi": 26, "fatal": 0}, {"month": "2025-09", "crashes": 358, "injury_crashes": 190, "ksi": 30, "fa